{
  "schemaVersion": "1.0",
  "title": "Decentralized Escrow Platform Development",
  "description": "Full-stack development of milestone-based freelance escrow with GitHub integration.",
  "client": "0x1111111111111111111111111111111111111111",
  "freelancer": "0x2222222222222222222222222222222222222222",
  "currency": "MATIC",
  "totalAmount": "1.5",
  "paymentMode": "MILESTONE",
  "latePenaltyBpsPerDay": 100,
  "maxLatePenaltyBps": 3000,
  "reviewWindowDays": 5,
  "graceDays": 3,
  "maxRevisions": 2,
  "github": {
    "repoUrl": "https://github.com/org/repo",
    "branch": "main"
  },
  "milestones": [
    {
      "index": 0,
      "title": "Milestone 1: Smart Contracts",
      "description": "Core escrow contracts",
      "amount": "0.5",
      "deadline": "2026-11-01T00:00:00Z",
      "requiredProgressBps": 8000,
      "acceptanceCriteria": [
        "Contract FairWork.sol compiles with 0 errors",
        "Unit tests pass with 90% coverage"
      ]
    },
    {
      "index": 1,
      "title": "Milestone 2: Backend & AI Integration",
      "description": "API endpoints and GitHub analyzer",
      "amount": "1.0",
      "deadline": "2026-11-15T00:00:00Z",
      "requiredProgressBps": 8500,
      "acceptanceCriteria": [
        "FastAPI service running on port 8000",
        "Endpoints pass integration tests"
      ]
    }
  ],
  "createdAt": "2026-10-10T12:00:00Z"
}
